name,producer,href,image_url,description
Breathe In Tea,11,https://www.pukkaherbs.com/nl/nl/products/breathe-in-tea,https://images.ctfassets.net/jhcmej8zlqgw/2qBEkuWohhzjy70P44MFcC/877f34bad678add0b980def619175eaf/Breathe_In_Amazon_A__Primary_Hero_20_Sachets_Roundel.png?fm=webp&w=400&q=80,"Verfris je zintuigen met onze vakkundig samengestelde Breathe In thee. Vind een moment van verlichting met het verfrissende aroma van munt en eucalyptus, de verwarmende sensatie van gember en de kalmerende ondersteuning van honing. Adem de stoom in om op te frissen en drink om te verzachten. Koele munt en eucalyptus werken synergetisch samen om je adem weer te vinden, je zintuigen te zuiveren, terwijl de stimulerende effecten van gember de zintuigen verfrissen tijdens het pollenseizoen en je een verwarmende omhelzing geven om de kou buiten te houden. Perfect voor dagelijkse ondersteuning, geeft de honing onze blend een delicate zoete en geruststellende afdronk.Breng de kruiden tot leven door de thee tot 15 minuten te laten trekken. Pukka is aangesloten bij 1% for the Planet en Fair for Life gecertificeerd."
Joy,11,https://www.pukkaherbs.com/nl/nl/products/joy,https://images.ctfassets.net/jhcmej8zlqgw/3rtqYAW6JVtWXGAWE4Gxz3/8698f95facc5c3a8936e09c1e52c136f/Joy_hero_image.png?fm=webp&w=400&q=80,"Ervaar een opbeurend gevoel met onze vakkundig samengestelde Joy thee. Boordevol met de meest vreugdevolle ingrediënten, een pittige sinaasappelsmaak en verfrissende citroenkruiden worden in balans gebracht met de bloemige twist van lavendel en roos om een harmonieuze kop zonneschijn te creëren. Lavendel staat traditioneel bekend om het verlichten van emotionele zorgen, het bevorderen van vrolijke en kalmerende energie, terwijl het bloemige aroma van roos je hart opent en dagelijkse vreugde ondersteunt. Citroen verheft je stemming en geeft je een sprankeling, terwijl de citrussmaak de ziel verfrist.Breng de kruiden tot leven door de thee tot 15 minuten te laten trekken. Pukka is aangesloten bij 1% for the Planet en Fair for Life gecertificeerd."
Elderberry & Echinacea,11,https://www.pukkaherbs.com/nl/nl/products/elderberry-and-echinacea,https://images.ctfassets.net/jhcmej8zlqgw/6TbLkDO6mZcTYKuQMaIwCs/2927105776c0395407b7d315e1befb59/Elderberry_hero.png?fm=webp&w=400&q=80,"Goed nieuws om je te troosten en voor te bereiden op de ups en downs van het leven. Gemaakt met biologische vlierbessen, echinaceawortel en -blad. Blijf warm en gezond. Het toevluchtsoord wacht op je. Laat jezelf vallen in een diep bed van rijpe wilde vruchten: paars-zwarte vlierbessen, inktzwarte zwarte bessen - gezegend door de geurige FairWild vlierbloesem en aangeraakt door de tintelende tonen van echinacea. Veilig in je fruitige toevluchtsoord, zul je klaar zijn voor alles. Blijf warm en gezond.Breng de kruiden tot leven door de thee tot 15 minuten te laten trekken. Pukka is aangesloten bij 1% for the Planet en Fair for Life gecertificeerd."
Love,11,https://www.pukkaherbs.com/nl/nl/products/love,https://images.ctfassets.net/jhcmej8zlqgw/16hC0NyR0pkIxQe5A5N4pr/2ad947ebb7610b67b8105914052e7b2a/Love_hero_image.png?fm=webp&w=400&q=80,"Perfect voor een kalmerende kruidenomhelzing, deze bloemenmix in een kopje is vakkundig samengesteld met kamille, roos, vlierbloesem, lavendel, lindebloesem en goudsbloem. Deze zachte en delicate blend is gemaakt met de hoogste kwaliteit, biologische ingrediënten die met zorg ethisch zijn verkregen van over de hele wereld. Open je hartgebied en voel de liefde bij elke voedzame slok.Breng de kruiden tot leven door de thee tot 15 minuten te laten trekken. Pukka is aangesloten bij 1% for the Planet en Fair for Life gecertificeerd."
"Chamomile, Vanilla & Manuka Honey",11,https://www.pukkaherbs.com/nl/nl/products/chamomile--vanilla-and-manuka-honey,https://images.ctfassets.net/jhcmej8zlqgw/5HrMkaHkTKtV1pvyo4CL1t/78abf731999522d052a737e109388678/Cham_Van_Man_hero_new.png?fm=webp&w=400&q=80,"Voel je kalm met onze vakkundig samengestelde Chamomile, Vanilla & Manuka Honey thee. Elke composteerbare theezak zit boordevol essentiële oliën en de hoogste kwaliteit kruiden, speciaal geselecteerd vanwege hun ontspannende eigenschappen. Het perfecte kopje om de geest en het lichaam te kalmeren, ontspan met elke rustgevende slok en geniet van de wolkeloze luchten. Breng de kruiden tot leven door de thee tot 15 minuten te laten trekken. Pukka is aangesloten bij 1% for the Planet en Fair for Life gecertificeerd."
Three Chamomile,11,https://www.pukkaherbs.com/nl/nl/products/three-chamomile,https://images.ctfassets.net/jhcmej8zlqgw/42l6YTV9hMTeyOddiXBDGL/286e7ed8896856e9b4d19f1bf08a8f06/24454_11996_Three_Chamomile_DTC_Hero_Image.png?fm=webp&w=400&q=80,"Een blend met kamilleVan nature cafeïnevrij, duurzaam verbouwd en 100% biologisch geteeld ingrediënten.Pukka is aangesloten bij 1% for the Planet. Dit product is Fair for Life & Fair Wild gecertificeerd.Breng de heerlijke kruiden tot leven door ze tot 15 minuten in vers gekookt water te laten trekken.Een doosje bevat 20 individueel verpakte theezakjes die volledig biologisch afbreekbaar zijn."
"Lemon, Ginger & Manuka Honey",11,https://www.pukkaherbs.com/nl/nl/products/lemon--ginger-and-manuka-honey,https://images.ctfassets.net/jhcmej8zlqgw/vmUO8qHo8NP99JFwlh6t7/51c8e99a809e0c8dfb52923600c713b6/Lem__gin__man_hero.png?fm=webp&w=400&q=80,"Voor heerlijke dagelijkse ondersteuning hoef je niet verder te zoeken dan onze vakkundig samengestelde Citroen, Gember en Manukahoning thee. Gemaakt met verwarmende kruiden zoals gember, kurkuma, citroen en kalmerende manukahoning, is deze blend een heerlijke kruidenomhelzing gedurende het hele jaar, vooral om eventuele rillingen te verdrijven. De perfecte manier om jezelf op de been te houden wanneer het leven je even uitput.Breng de kruiden tot leven door de thee tot 15 minuten te laten trekken. Pukka is aangesloten bij 1% for the Planet en Fair for Life gecertificeerd."
Supreme Matcha Green,11,https://www.pukkaherbs.com/nl/nl/products/supreme-matcha-green,https://images.ctfassets.net/jhcmej8zlqgw/3S0rJEQ5RljWovt9qOf5Qc/20f672a2c9ecdf76f4c8b7330bfb1058/20740_Supreme_Green_Match___Shopper_Hero_Image.png?fm=webp&w=400&q=80,"Ondersteun dagelijkse vitaliteit met onze vakkundig samengestelde Supreme Matcha Green thee. Gemaakt met de hoogste kwaliteit, 100% biologische ingrediënten zoals matchapoeder en drie soorten hele bladgroene thee, is deze krachtige blend perfect voor dagelijkse vitaliteit.
Gecreëerd door kruidenkenners en voedingsdeskundigen, combineert onze Supreme Matcha Green-thee de nieuwste wetenschappelijke inzichten met traditionele kruidenwijsheid om op natuurlijke wijze je geest en lichaam te ondersteunen. Het perfecte kopje om je ochtenden kracht bij te zetten.Breng de kruiden tot leven door de thee tot 15 minuten te laten trekken. Pukka is aangesloten bij 1% for the Planet en Fair for Life gecertificeerd."
Three Licorice,11,https://www.pukkaherbs.com/nl/nl/products/three-licorice,https://images.ctfassets.net/jhcmej8zlqgw/1QmokMAzugfvRjglXLbAim/7038bdfb141e1204dfed64d94e526582/three_licorice_hero_new.2.png?fm=webp&w=400&q=80,"Geniet op ieder moment van de heerlijke smaak van zoethout.Van nature cafeïnevrij, duurzaam verbouwd en 100% biologisch geteeld ingrediënten.Pukka is aangesloten bij 1% for the Planet. Dit product is Fair for Life & Fair Wild gecertificeerd.Breng de heerlijke kruiden tot leven door ze tot 15 minuten in vers gekookt water te laten trekken.Een doosje bevat 20 individueel verpakte theezakjes die volledig biologisch afbreekbaar zijn."
Mint Refresh,11,https://www.pukkaherbs.com/nl/nl/products/mint-refresh,https://images.ctfassets.net/jhcmej8zlqgw/1uTF0ENzIPTd0pPpvhD3hn/b413b49cd2101147da9472f8e366874e/Mint_refresh_hero_image_new.2.png?fm=webp&w=400&q=80,"Een blend met pepermunt, zoethout, venkel, hibiscus, rozenbloesem en korianderVan nature cafeïnevrij, duurzaam verbouwd en 100% biologisch geteeld ingrediënten.Pukka is aangesloten bij 1% for the Planet. Dit product is Fair for Life & Fair Wild gecertificeerd.Breng de heerlijke kruiden tot leven door ze tot 15 minuten in vers gekookt water te laten trekken.Een doosje bevat 20 individueel verpakte theezakjes die volledig biologisch afbreekbaar zijn."
Blackcurrant Beauty,11,https://www.pukkaherbs.com/nl/nl/products/blackcurrant-beauty,https://images.ctfassets.net/jhcmej8zlqgw/7JHB0aWpVii7tsrEwKoG8c/c1a6afde20eee489faa0198378b712cf/Blackcurrant_beauty_hero_image_new.png?fm=webp&w=400&q=80,"Een blend met rozenbottel, hibiscus, venkelzaad, zoethout en rode biet.Van nature cafeïnevrij, duurzaam verbouwd en 100% biologisch geteeld ingrediënten.Pukka is aangesloten bij 1% for the Planet. Dit product is Fair for Life & Fair Wild gecertificeerd.Breng de heerlijke kruiden tot leven door ze tot 15 minuten in vers gekookt water te laten trekken.Een doosje bevat 20 individueel verpakte theezakjes die volledig biologisch afbreekbaar zijn."
Turmeric Active,11,https://www.pukkaherbs.com/nl/nl/products/turmeric-active,https://images.ctfassets.net/jhcmej8zlqgw/1jxzCriSalY3uB5SGpYKUg/41bc1d47303c5ae8fc9e677c5ef0e9ed/Turmeric_active_hero_.2.png?fm=webp&w=400&q=80,"Ondersteun je actieve levensstijl met onze Turmeric Active thee. Vakkundig gemengd met verjongende kruiden, kurkuma, gember en galanga, houdt ons krachtige mengsel je de hele dag sprankelend. Gecreëerd door kruidenkenners en voedingsdeskundigen, combineert onze Turmeric Active thee de nieuwste wetenschappelijke inzichten met traditionele kruidenwijsheid om je lichaam op natuurlijke wijze te ondersteunen. 
Elke composteerbare theezakje zit boordevol essentiële oliën en de hoogste kwaliteit biologische kruiden, speciaal geselecteerd vanwege hun revitaliserende eigenschappen.Breng de kruiden tot leven door de thee tot 15 minuten te laten trekken. Pukka is aangesloten bij 1% for the Planet en Fair for Life gecertificeerd."
Three Fennel,11,https://www.pukkaherbs.com/nl/nl/products/three-fennel,https://images.ctfassets.net/jhcmej8zlqgw/4FOEW4L3dP4ZcgnCyl2sBz/f86b29e086e742958a9412d4a28cb99a/three_fennel_hero_new.2.png?fm=webp&w=400&q=80,"Geniet van een pure blend met venkelzaad, wilde venkel en venkelblad.Van nature cafeïnevrij, duurzaam verbouwd en 100% biologisch geteeld ingrediënten.Pukka is aangesloten bij 1% for the Planet. Dit product is Fair for Life & Fair Wild gecertificeerd.Breng de heerlijke kruiden tot leven door ze tot 15 minuten in vers gekookt water te laten trekken.Een doosje bevat 20 individueel verpakte theezakjes die volledig biologisch afbreekbaar zijn."
Cleanse,11,https://www.pukkaherbs.com/nl/nl/products/cleanse,https://images.ctfassets.net/jhcmej8zlqgw/1bmMtUJ0tKlil1WpH8Y56c/f9a5b82ccb15ae0fe55106f5595e8dad/19426_68714799_850835000498_Cleanse_UK_Nord_Trafford___Kato_Carton_Hero_Image.png?fm=webp&w=400&q=80,"Een blend met venkel, brandnetel en pepermunt.Van nature cafeïnevrij, duurzaam verbouwd en 100% biologisch geteeld ingrediënten.Pukka is aangesloten bij 1% for the Planet. Dit product is Fair for Life & Fair Wild gecertificeerd.Breng de heerlijke kruiden tot leven door ze tot 15 minuten in vers gekookt water te laten trekken.Een doosje bevat 20 individueel verpakte theezakjes die volledig biologisch afbreekbaar zijn."
Night Time,11,https://www.pukkaherbs.com/nl/nl/products/night-time,https://images.ctfassets.net/jhcmej8zlqgw/6GJReEYARPb9o5toq6QWSn/e64955167e630e2b8a9394f4506a076a/Night_time_tea_Hero_image.2.png?fm=webp&w=400&q=80,"Een blend met haverbloem, verzachtende lavendel en zijdezachte lindebloesem.Van nature cafeïnevrij , duurzaam verbouwd en 100% biologisch geteelde ingrediënten.Pukka is aangesloten bij 1% for the Planet. Dit product is Fair for Life & Fair Wild gecertificeerd.Breng de heerlijke kruiden tot leven door ze tot 15 minuten in vers gekookt water te laten trekken.Een doosje bevat 20 individueel verpakte theezakjes die volledig biologisch afbreekbaar zijn"
Lean Matcha Green,11,https://www.pukkaherbs.com/nl/nl/products/lean-matcha-green,https://images.ctfassets.net/jhcmej8zlqgw/5zow1Ssabkh9g4298iXZ3v/bd44fa0517fcc4d296c5686e10dd4ddd/5013_2019_Hero_Images_-removebg-preview.png?fm=webp&w=400&q=80,"Laat jouw innerlijke vlam te ontwaken met deze heerlijke blend met kaneel, gember en venkel voor een krachtige boos..Duurzaam verbouwde, 100% biologisch geteelde ingrediënten.Pukka is aangesloten bij 1% for the Planet. Dit product is Fair for Life & Fair Wild gecertificeerd.Breng de heerlijke kruiden tot leven door ze tot 15 minuten in vers gekookt water te laten trekken.Een doosje bevat 20 individueel verpakte theezakjes die volledig biologisch afbreekbaar zijn."
Ginseng Matcha Green,11,https://www.pukkaherbs.com/nl/nl/products/ginseng-matcha-green,https://images.ctfassets.net/jhcmej8zlqgw/5P2NCgMxP5mPGoLsUPvG5V/0b5475bb549189962567be36197430d3/Ginseng_matcha_green_hero_UK.png?fm=webp&w=400&q=80,"Voel je gevoed met onze vakkundig samengestelde Ginseng Matcha Green-thee. Onze opwekkende blend is een synergetische combinatie van de verfrissende smaken van groene thee en matcha, de citrustwist van citroengras en ginseng, en de warmte van pittige gember. Zowel matcha als groene thee zorgen natuurlijk voor je lichaam, houden je vitaliteit in stand, terwijl de opbeurende eigenschappen van citroengras en ginseng een sprankeling aan je dag toevoegen en je scherp houden. Gember is toegevoegd vanwege zijn verwarmende en stimulerende effecten die helpen bij het opbouwen van het spijsverteringsvuur.Breng de kruiden tot leven door de thee tot 15 minuten te laten trekken. Pukka is aangesloten bij 1% for the Planet en Fair for Life gecertificeerd."
Lemongrass & Ginger,11,https://www.pukkaherbs.com/nl/nl/products/lemongrass-and-ginger,https://images.ctfassets.net/jhcmej8zlqgw/307v0XMpPktZic4tMLoO3w/50c51bb06d3b618c62434d68663247ef/lemongrass_and_ginger_hero.png?fm=webp&w=400&q=80,"Goed nieuws om je dag op te vrolijken en te verfrissen. Gemaakt met biologische gember, citroenverbena, citroengras en zoethoutwortel.
Een slok en je bent klaar om op te stijgen, zweef mee in een wervelwind van citroenfrisheid. Echte rijkdom zit van binnen. Het kostbaarste dat het leven te bieden heeft, wacht hier op je om van te genieten; een pittige werveling van de fijnste citroengras en de kruidige opkikker van gember; laat ze samen trekken en neem een slok om je dag op te vrolijken en te verfrissen.Breng de kruiden tot leven door de thee tot 15 minuten te laten trekken. Pukka is aangesloten bij 1% for the Planet en Fair for Life gecertificeerd."
Gorgeous Earl Grey,11,https://www.pukkaherbs.com/nl/nl/products/gorgeous-earl-grey,https://images.ctfassets.net/jhcmej8zlqgw/26GiWvfm6F7ON04GTFrR3x/6801ed5755499d284b67dcf970a64dea/Earl_grey_hero_image_UK.png?fm=webp&w=400&q=80,"Afkomstig van enkele van 's werelds meest uitzonderlijke biologische theelandgoederen, hebben onze experts een Earl Grey-blend samengesteld met een twist. Geniet van de klassieke bergamot en lavendelhints, met een citrusachtige citroenafdronk, terwijl we de biologische zwarte thee uit India en Oost-Afrika vieren. Trakteer jezelf op een bijzondere ervaring met zwarte thee zoals geen ander en proef de kwaliteit van Pukka.Breng de kruiden tot leven door de thee tot 15 minuten te laten trekken. Pukka is aangesloten bij 1% for the Planet en Fair for Life gecertificeerd."
Herbal Collection,11,https://www.pukkaherbs.com/nl/nl/products/herbal-collection,https://images.ctfassets.net/jhcmej8zlqgw/1jbyFDUFSGFyHMJwSR9uGb/b7d05b3b03e43ec484193da09876dcf7/19423_68687780_5060229012371_Herbal_Collection_UK_Nord_Trafford_Carton_Hero_Image.png?fm=webp&w=400&q=80,"Van nature cafeïnevrij, duurzaam verbouwd en 100% biologisch geteeld ingrediënten.Pukka is aangesloten bij 1% for the Planet. Dit product is Fair for Life & Fair Wild gecertificeerd.Breng de heerlijke kruiden tot leven door ze tot 15 minuten in vers gekookt water te laten trekken.Een doosje bevat 20 individueel verpakte theezakjes die volledig biologisch afbreekbaar zijn."
Vanilla Chai,11,https://www.pukkaherbs.com/nl/nl/products/vanilla-chai,https://images.ctfassets.net/jhcmej8zlqgw/74xBuIvAo64N3nTNd6IWWI/0edf21981d55efbbeb60d73e2e035bb7/Vanilla_chai_hero.2.png?fm=webp&w=400&q=80,"Perfect voor een natuurlijke cafeïnevrije boost, is onze Vanilla Chai-thee vakkundig gemengd met vanille, kaneel, gember, kardemom en meer. 
Gecreëerd door kruidenkenners en voedingsdeskundigen combineert deze thee de nieuwste wetenschappelijke inzichten met traditionele kruidenwijsheid om op natuurlijke wijze je energie te ondersteunen. Adem de kruidige aroma's in, nip van de heerlijke kruiden en bloei op in de komende dag.Breng de kruiden tot leven door de thee tot 15 minuten te laten trekken. Pukka is aangesloten bij 1% for the Planet en Fair for Life gecertificeerd."
Feel New,11,https://www.pukkaherbs.com/nl/nl/products/feel-new,https://images.ctfassets.net/jhcmej8zlqgw/51kMIXWeSsygI5Nv8ZUKcd/a5cb531af8aea26eaeee084950d870e7/20741_Feel_New__Shopper_Hero_Image.png?fm=webp&w=400&q=80,"Voel je goed met onze vakkundig samengestelde Feel New-thee. Gemaakt met pure kruiden zoals anijszaad, venkel, kardemom en kurkuma, vult onze zalige mix je met geluk en zorgt ervoor dat je je op je best voelt.
Ontwikkeld door kruidenkenners en voedingsdeskundigen, combineert onze Feel New-thee de nieuwste wetenschappelijke inzichten met traditionele kruidenwijsheid om je lichaam en geest op natuurlijke wijze te ondersteunen.Breng de kruiden tot leven door de thee tot 15 minuten te laten trekken. Pukka is aangesloten bij 1% for the Planet en Fair for Life gecertificeerd."
Day to Night Collection,11,https://www.pukkaherbs.com/nl/nl/products/day-to-night-collection,https://images.ctfassets.net/jhcmej8zlqgw/2LytGAlHXG9BbMTVDeMpLU/ae28582d402f8d1e8196cf4cd96c66d5/D2N_collection.png?fm=webp&w=400&q=80,"Duurzaam verbouwde, 100% biologisch geteelde ingrediënten.Pukka is aangesloten bij 1% for the Planet. Dit product is Fair for Life & Fair Wild gecertificeerd.Breng de heerlijke kruiden tot leven door ze tot 15 minuten in vers gekookt water te laten trekken.Een doosje bevat 20 individueel verpakte theezakjes die volledig biologisch afbreekbaar zijn."
Revitalise,11,https://www.pukkaherbs.com/nl/nl/products/revitalise,https://images.ctfassets.net/jhcmej8zlqgw/76s1IMI1SyfGFrBMSNbS6o/a0f40c8ebfba571a0945cc372849f784/revitalise_hero.2.png?fm=webp&w=400&q=80,"Een klassieke Pukka blend met kaneel, kardemom en gember.Duurzaam verbouwde, 100% biologisch geteelde ingrediënten.Pukka is aangesloten bij 1% for the Planet. Dit product is Fair for Life & Fair Wild gecertificeerd.Breng de heerlijke kruiden tot leven door ze tot 15 minuten in vers gekookt water te laten trekken.Een doosje bevat 20 individueel verpakte theezakjes die volledig biologisch afbreekbaar zijn."
Peppermint & Licorice,11,https://www.pukkaherbs.com/nl/nl/products/peppermint-and-licorice,https://images.ctfassets.net/jhcmej8zlqgw/1PqLvomovHlOPI3JWEvjyb/dcb5dc89a77cdd2a455424425019bfbd/pep_min_and_lic_hero.png?fm=webp&w=400&q=80,"Voel je getroost na het eten met onze vakkundig samengestelde Pepermunt & Zoethout-thee. Boordevol verfrissende pepermunt en zoete zoethout, helpt onze after-dinner helper je comfortabeler te voelen terwijl je verteert. De perfecte manier om zoete verlangens te verminderen, de hele dag in balans te blijven en op te bloeien met elke zoete slok.Breng de kruiden tot leven door de thee tot 15 minuten te laten trekken. Pukka is aangesloten bij 1% for the Planet en Fair for Life gecertificeerd."
Three Mint,11,https://www.pukkaherbs.com/nl/nl/products/three-mint,https://images.ctfassets.net/jhcmej8zlqgw/25vudVG5SFOiJE3XNlh8aL/8d66787a0da0525b5d780b4382d026ac/three_mint_hero.2.png?fm=webp&w=400&q=80,"Verfris jezelf met Three Mint thee. Vakkundig gemengd met munt, pepermunt en akkermunt, is dit een geweldige ondersteuning om je lichaam te verkoelen, vooral na de maaltijden tijdens de spijsvertering.  Elke composteerbare theezak zit boordevol essentiële oliën en de hoogste kwaliteit kruiden, speciaal geselecteerd vanwege hun kalmerende en rustgevende eigenschappen. Perfect om koel en comfortabel te blijven.Breng de kruiden tot leven door de thee tot 15 minuten te laten trekken. Pukka is aangesloten bij 1% for the Planet en Fair for Life gecertificeerd."
Elegant English Breakfast,11,https://www.pukkaherbs.com/nl/nl/products/elegant-english-breakfast,https://images.ctfassets.net/jhcmej8zlqgw/58Mz5gyjx6cspbP8wpwaEP/1821e048172dd0a9a2e884d6ce060826/Elegant_English_breakfast_hero_image_new.2.png?fm=webp&w=400&q=80,"Afkomstig van enkele van 's werelds meest uitzonderlijke biologische theelandgoederen, hebben onze experts een Engelse ontbijtthee gemengd om de rijke, volle smaak van biologische zwarte thee uit India en Oost-Afrika te vieren. We weten hoe belangrijk een kopje thee van hoge kwaliteit is om van een moment voor jezelf te genieten en de dag te onderbreken, dus trakteer jezelf op de ervaring en de kwaliteitssmaak van Pukka.Breng de kruiden tot leven door de thee tot 15 minuten te laten trekken. Pukka is aangesloten bij 1% for the Planet en Fair for Life gecertificeerd."
Three Cinnamon,11,https://www.pukkaherbs.com/nl/nl/products/three-cinnamon,https://images.ctfassets.net/jhcmej8zlqgw/1emNiAM0Ay64Mp7ENohcBT/5d2a96f99849e2606cd45811d0e14ddf/three_cinnamon_hero.2.png?fm=webp&w=400&q=80,"Van nature cafeïnevrij, duurzaam verbouwd en 100% biologisch geteeld ingrediënten.Pukka is aangesloten bij 1% for the Planet. Dit product is Fair for Life & Fair Wild gecertificeerd.Breng de heerlijke kruiden tot leven door ze tot 15 minuten in vers gekookt water te laten trekken.Een doosje bevat 20 individueel verpakte theezakjes die volledig biologisch afbreekbaar zijn."
Mint Matcha Green,11,https://www.pukkaherbs.com/nl/nl/products/mint-matcha-green,https://images.ctfassets.net/jhcmej8zlqgw/1YngviODAwsXkKJcbM9Qft/aac0a2995519515bc81c4c6ffd52416b/5004_2019_Hero_Images___1_.png?fm=webp&w=400&q=80,"Een blend van groene matcha en pepermunt.Duurzaam verbouwde, 100% biologisch geteelde ingrediënten.Pukka is aangesloten bij 1% for the Planet. Dit product is Fair for Life & Fair Wild gecertificeerd.Breng de heerlijke kruiden tot leven door ze tot 15 minuten in vers gekookt water te laten trekken.Een doosje bevat 20 individueel verpakte theezakjes die volledig biologisch afbreekbaar zijn."
Turmeric Gold,11,https://www.pukkaherbs.com/nl/nl/products/turmeric-gold,https://images.ctfassets.net/jhcmej8zlqgw/2L4qiNkbhv3SeCI5BeU7AL/3507066280f8666e9cbc5ea567263503/Turmeric_gold_hero_UK.png?fm=webp&w=400&q=80,"Een blend met biologische kurkuma, groene thee, kardemom en citroen.Duurzaam verbouwde, 100% biologisch geteelde ingrediënten.Pukka is aangesloten bij 1% for the Planet. Dit product is Fair for Life & Fair Wild gecertificeerd.Breng de heerlijke kruiden tot leven door ze tot 15 minuten in vers gekookt water te laten trekken.Een doosje bevat 20 individueel verpakte theezakjes die volledig biologisch afbreekbaar zijn"
Green Collection,11,https://www.pukkaherbs.com/nl/nl/products/green-collection,https://images.ctfassets.net/jhcmej8zlqgw/wL8iDN37JDPtE1B77w6cz/929ef21b3c48d4066d4e0d2607d0d898/18214_68668624_5060519147363_Green_Collection_UK_Nord_Trafford_Carton_Hero_Image.png?fm=webp&w=400&q=80,"Duurzaam verbouwde, 100% biologisch geteelde ingrediënten.Pukka is aangesloten bij 1% for the Planet. Dit product is Fair for Life & Fair Wild gecertificeerd.Breng de heerlijke kruiden tot leven door ze tot 15 minuten in vers gekookt water te laten trekken.Een doosje bevat 20 individueel verpakte theezakjes die volledig biologisch afbreekbaar zijn."
Clean Matcha Green,11,https://www.pukkaherbs.com/nl/nl/products/clean-matcha-green,https://images.ctfassets.net/jhcmej8zlqgw/tcyoURKZfo0VNll2oi0PO/df3c88f7bcddb6107444558e528c59f5/Clean_matcha_green_hero_image_2019.2.png?fm=webp&w=400&q=80,"Een blend met groen thee, venkel, paardebloem, zoethout & citroenmirte.Duurzaam verbouwde, 100% biologisch geteelde ingrediënten"
Wild Apple & Cinnamon,11,https://www.pukkaherbs.com/nl/nl/products/wild-apple-and-cinnamon,https://images.ctfassets.net/jhcmej8zlqgw/149ZoUNKkMSCeWkzmszFkb/61b2f0a8afe1e6d80791b3eb018e1161/Wild_apple_and_cinnamon_hero_UK.png?fm=webp&w=400&q=80,"Welkom bij de knusse en weelderige wonderen van onze vakkundig samengestelde Wild Apple & Cinnamon thee. Een mix van sappige appels, zoete kaneel, pittige sinaasappel en kruidige kardemom, allemaal perfect in balans om een kop thee te creëren die even geruststellend is als heerlijk. Kruip onder een deken en laat de fruitige smaken je van binnenuit verwarmen. 
Of je nu behoefte hebt aan een knus moment voor jezelf of een oppepper in de middag, Wild Apple & Cinnamon-thee is het ultieme genot.
Of je nu een moment voor jezelf neemt of een kop deelt met dierbaren, deze thee zal je dag doordrenken met warmte, comfort en geluk.Breng de kruiden tot leven door de thee tot 15 minuten te laten trekken. Pukka is aangesloten bij 1% for the Planet en Fair for Life gecertificeerd."
