name,producer,href,image_url,description
Original Chai,11,https://www.pukkaherbs.com/nl/nl/products/original-chai,https://images.ctfassets.net/jhcmej8zlqgw/ch0RjqMqKDyi5R6rr856u/347f21715b9fd8824e800f4fe369bd04/Original_chai_hero_image_new.png?fm=webp&w=400&q=80,"Bij elke slok van onze vakkundig samengestelde Original Chai thee word je meegevoerd naar een plek van pure aromatische verrukking. Laat de vurige warmte van gember en de kruidige omhelzing van kardemom je zintuigen ontwaken, terwijl de rijke tonen van kaneel en de volle zwarte thee op je tong dansen. 
Of je nu een moment voor jezelf neemt of een kop deelt met dierbaren, deze thee zal je dag vullen met warmte, comfort en geluk. Onze kaneel, een sleutelingrediënt in ons knusse assortiment, komt van een gecertificeerd fairtrade-project in de heuvels van Noord-Vietnam. Bij de oogsttijd wordt de waardevolle binnenbast geschild en in de zon gedroogd, waar deze van nature krult tot kaneelstokjes. Breng de kruiden tot leven door de thee tot 15 minuten te laten trekken. Pukka is aangesloten bij 1% for the Planet en Fair for Life gecertificeerd."
Three Ginger,11,https://www.pukkaherbs.com/nl/nl/products/three-ginger,https://images.ctfassets.net/jhcmej8zlqgw/3vw1q9eOcrtcetUtyb7Gtw/f94598ce1c53e98060ee42fdbce12477/three_ginger_hero_new.2.png?fm=webp&w=400&q=80,"Activeer voorzichtig je spijsverteringsvuur met onze Three Ginger thee. Samengesteld met verwarmende kruiden zoals gember, galanga en kurkuma, en in balans gebracht met zoete zoethoutwortel, is dit een uitstekende keuze voor of na de maaltijd. 
Gecreëerd door kruidenkenners en voedingsdeskundigen combineert onze Three Ginger-thee de nieuwste wetenschappelijke inzichten met traditionele kruidenwijsheid om je lichaam op natuurlijke wijze te troosten en ondersteunen. Het perfecte kopje bij de maaltijd.Breng de kruiden tot leven door de thee tot 15 minuten te laten trekken. Pukka is aangesloten bij 1% for the Planet en Fair for Life gecertificeerd."
Licorice & Cinnamon,11,https://www.pukkaherbs.com/nl/nl/products/licorice-and-cinnamon,https://images.ctfassets.net/jhcmej8zlqgw/5LjPvURpuU0AlGfbhl2n94/3ab01e7d50703ccd7b4f06d4986b99c5/Licorice_and_cinnamon_hero_UK.png?fm=webp&w=400&q=80,"Een blend met cacao, kaneel en zoethout.Duurzaam verbouwde, 100% biologisch geteelde ingrediënten.Pukka is aangesloten bij 1% for the Planet. Dit product is Fair for Life & Fair Wild gecertificeerd.Breng de heerlijke kruiden tot leven door ze tot 15 minuten in vers gekookt water te laten trekken.Een doosje bevat 20 individueel verpakte theezakjes die volledig biologisch afbreekbaar zijn."
Tulsi Clarity,11,https://www.pukkaherbs.com/nl/nl/products/tulsi-clarity,https://images.ctfassets.net/jhcmej8zlqgw/2024lRYkU1wKq1pBUvOzaK/3e2dcd83282f2b1c140cc1fe9afaacaa/tulsi_clarity_hero_.2.png?fm=webp&w=400&q=80,"Van nature cafeïnevrij, duurzaam verbouwd en 100% biologisch geteeld ingrediënten.Pukka is aangesloten bij 1% for the Planet. Dit product is Fair for Life & Fair Wild gecertificeerd.Breng de heerlijke kruiden tot leven door ze tot 15 minuten in vers gekookt water te laten trekken.Een doosje bevat 20 individueel verpakte theezakjes die volledig biologisch afbreekbaar zijn."
Womankind,11,https://www.pukkaherbs.com/nl/nl/products/womankind,https://images.ctfassets.net/jhcmej8zlqgw/1nb81QtToEaojQ0hRBlddO/e5b669d112080b64b7524791e0bb308f/womankind_hero.2.png?fm=webp&w=400&q=80,"De bloemen in jou staan klaar om te bloeien, een liefdevol kopje voeding is alles wat nodig is om ze tot leven te wekken. Deze blend is gemaakt met biologische kamille, shatavari, cranberry, roos en zoete vanille.
Balans is een geschenk voor geest en lichaam. Ze is een van de meest vorstelijke wortels van India, dus laat shatavari je haar hangmat van rust weven. Kamille om te strelen, zoete zoethout en vanille om al je zintuigen te kalmeren. Vervolgens brengen cranberry, sinaasappel, goudsbloem en roos al je kleur weer tot leven. Een kopje perfecte balans om lichaam en ziel te herstellen.Breng de kruiden tot leven door de thee tot 15 minuten te laten trekken. Pukka is aangesloten bij 1% for the Planet en Fair for Life gecertificeerd."
After Dinner,11,https://www.pukkaherbs.com/nl/nl/products/after-dinner,https://images.ctfassets.net/jhcmej8zlqgw/RjHp0n0XiLkrB6YcMo3bx/ed4e8ceb71a92a94d2efc8b06990a3a5/After_dinner_hero_image_new.2.png?fm=webp&w=400&q=80,"Een blend met cichorei, anijszaad, venkel, zoethout, kardemom, venkel en gember.Van nature cafeïnevrij, duurzaam verbouwd en 100% biologisch geteeld ingrediënten.Pukka is aangesloten bij 1% for the Planet. Dit product is Fair for Life & Fair Wild gecertificeerd.Breng de heerlijke kruiden tot leven door ze tot 15 minuten in vers gekookt water te laten trekken.Een doosje bevat 20 individueel verpakte theezakjes die volledig biologisch afbreekbaar zijn."
Night Time Berry,11,https://www.pukkaherbs.com/nl/nl/products/night-time-berry,https://images.ctfassets.net/jhcmej8zlqgw/64mludoKuyYqcRdlu1kXy8/91dd67309857d35a60f4a6ef9fc510d1/Night_time_berry_hero.2.png?fm=webp&w=400&q=80,"Drijf weg naar een vredige rust. Verzacht je zintuigen en laat de dag tot nu toe los met een kopje Night Time Berry, ons nieuwste mengsel in ons Slaap- welzijnsassortiment. Een herstellende blend van rijke bessen, kalmerende kamille, valeriaanwortel en echinacea. Breng de kruiden tot leven door de thee tot 15 minuten te laten trekken. Pukka is aangesloten bij 1% for the Planet en Fair for Life gecertificeerd."
Fresh Start,11,https://www.pukkaherbs.com/nl/nl/products/fresh-start,https://images.ctfassets.net/jhcmej8zlqgw/z04eELh0WfJhErI54l7dv/e3628773da28f76ea5a3bf829eb1cf86/12857_FreshStart_PENT_ENG_Hero_JPG.png?fm=webp&w=400&q=80,"Een blend met citroengras, zoete venkel en korianderVan nature cafeïnevrij, duurzaam verbouwd en 100% biologisch geteeld ingrediënten.Pukka is aangesloten bij 1% for the Planet. Dit product is Fair for Life & Fair Wild gecertificeerd.Breng de heerlijke kruiden tot leven door ze tot 15 minuten in vers gekookt water te laten trekken.Een doosje bevat 20 individueel verpakte theezakjes die volledig biologisch afbreekbaar zijn."
Peace,11,https://www.pukkaherbs.com/nl/nl/products/peace,https://images.ctfassets.net/jhcmej8zlqgw/3cGeL0OiugijjHUTd85o6O/8afca576bb7765f4cd96258f3dde3041/24452_11996_Peace_DTC_Hero_Image.png?fm=webp&w=400&q=80,"Voel je kalm met onze Peace thee. Ambachtelijk gemaakt met balancerende kruiden zoals kamille, lavendel, munt, ashwagandha en hennepzaadolie, ondersteunt deze adaptogene blend de natuurlijke reactie van je geest en lichaam op de druk van het leven. Gecreëerd door kruidenkenners en voedingsdeskundigen combineert onze Peace thee de nieuwste wetenschappelijke inzichten met traditionele kruidenwijsheid om je kalm te houden. Het perfecte kopje dat vriendelijk is voor de geest, geniet van de serene sensatie en vind rust. Breng de kruiden tot leven door de thee tot 15 minuten te laten trekken. Pukka is aangesloten bij 1% for the Planet en Fair for Life gecertificeerd."
Relax,11,https://www.pukkaherbs.com/nl/nl/products/relax,https://images.ctfassets.net/jhcmej8zlqgw/tz8ulYLiA0f9rHkmR3crc/23e37473e667ac670299fb40ef969cd2/Relax_hero_image.png?fm=webp&w=400&q=80,"Voel je kalm met onze vakkundig samengestelde Relax thee. Gemaakt met kalmerende kruiden zoals venkel, kamille, havermoutbloemen en kardemom, dompelt onze rustgevende blend je natuurlijk onder in een rustige stemming. Gecreëerd door kruidenkenners en voedingsdeskundigen, combineert onze Relax-thee de nieuwste wetenschappelijke inzichten met traditionele kruidenwijsheid om je op natuurlijke wijze te kalmeren. Het perfecte kopje om de last van je schouders te nemen, ontspan met elke dromerige druppel en geniet van de serene sensatie.Breng de kruiden tot leven door de thee tot 15 minuten te laten trekken. Pukka is aangesloten bij 1% for the Planet en Fair for Life gecertificeerd."
Winter Warmer 20 Tea Bags,11,https://www.pukkaherbs.com/nl/nl/products/winter-warmer,https://images.ctfassets.net/jhcmej8zlqgw/Fl2zp7LD18PjTc5dsN9kX/f55b66aa4756538d81fae8b31c8c387c/32182_12023_DTC_Hero_Image_Winter_Warmer.png?fm=webp&w=400&q=80,"Geniet van de essentie van het seizoen met onze Winter Warmer thee. Een harmonieuze mix van biologische ingrediënten, de pittigheid van sinaasappelschil en citroenmelisse wordt geïnfuseerd met de verwarmende kruiden van kruidnagel en gember. Naarmate de warmte toeneemt, voegen de zoete tonen van kaneel en steranijs een vleugje luxe toe, waardoor een moment van comfort en vreugde ontstaat. Oproepend tot herinneringen aan knapperende vuren en feestelijke vrolijkheid, is deze seizoenseditie winterthee een cafeïnevrije traktatie voor alle zintuigen.Breng de kruiden tot leven door de thee tot 15 minuten te laten trekken. Pukka is aangesloten bij 1% for the Planet en Fair for Life gecertificeerd."
