name,producer,href,image_url,description
Yunnan Golden Tips,1,https://www.simonlevelt.nl/yunnan-golden-tips,https://www.simonlevelt.nl/media/image/39/4a/22/35be7e2b-0b20-4303-a8b9-5b9dd61531bboyd41HRwFwieM_600x600.png,"De vele gouden tips geven deze thee zijn naam en zorgen voor een gouden glans. De thee is zoetig en heeft een intens aroma. Herken tonen van honing, caramel en houttonen. De thee is zeer aangenaam, fluwelig haast en heeft totaal geen bitters.  De thee komt uit de provincie Yunnan in zuidwest China. Deze thee staat ook bekend als Dian Hong Gong Fu.  Dian staat voor Yunnan en Hong voor 'rode' thee. Wat wij zwarte thee noemen, wordt in China namelijk rode thee genoemd. Gong Fu staat voor 'kundig'. Je moet als theemeester kundig zijn om deze thee te kunnen maken. De thee wordt in de lente én zomer geplukt."
Oolong Finest - 20 builen,1,https://www.simonlevelt.nl/oolong-finest-20-builen,https://www.simonlevelt.nl/media/image/ef/0a/94/a5f86aaf-a80f-4a84-938c-3684cf78ef84_600x600.png,"Oolong Finest Premium Organic Tea is een prachtige volle, zoete oolong thee. Deze oolong is mooi in balans, mild en soepel met een licht notige, houtige smaak en een hint van laurier. Een doosje bevat 20 theezakjes Premium Organic Oolong Finest."
Yunnan Silver Dragon,1,https://www.simonlevelt.nl/yunnan-silver-dragon,https://www.simonlevelt.nl/media/image/03/a2/87/898ebfdb-c5dd-48ac-9450-f19c34f05e4f_600x600.png,"Groot, mooi regelmatig gerold theeblad. Het theeblad is gekruld en heeft zilverwitte tips en ontleent zijn naam en vorm en kleur. Voor een groene thee is de Yunnan Silver Dragon een krachtige thee met een volle, lichtkruidige smaak en tonen van salie en alfalfa. Al eeuwenlang produceert men in Yunnan groene thee. De Silver Dragon is daarom met recht een klassieker! De cultivar is Yunnan Meng Ke Big Leaves. De thee wordt in de lente geplukt."
Earl Grey Original Premium Organic Tea - 90...,1,https://www.simonlevelt.nl/earl-grey-original-premium-organic-tea-90-gram-losse-thee,https://www.simonlevelt.nl/media/image/48/c8/01/d2d3cdbb-d9db-4435-8468-66eb7f5280dc_600x600.png,"Earl Grey is de populairste ‘smaakjesthee’ ter wereld, en niet voor niets. De volle, krachtige smaak van zwarte thee combineert prima met de frisse citrussmaak van bergamot. Premium Organic Earl Grey Original is een traditionele Earl Grey thee. Heerlijk om te drinken als je last hebt van een middagdip, deze thee schudt je weer even helemaal wakker!"
Da Hong Pao oolong,1,https://www.simonlevelt.nl/da-hong-pao-oolong,https://www.simonlevelt.nl/media/image/ec/9c/fe/5ea66a49-d960-4f5c-aa5f-6941761962b7_600x600.png,"Da Hong Pao is een Chinese Oolong met een uitgebalanceerde zoete, licht geroosterde smaak, waarbij tonen van zoethout en noten naar voren komen. Da Hong Pao is een typische Rock Tea. De rotsachtige omgeving waarin deze thee groeit, geeft de thee een mineraalachtige smaak. Deze thee kun je meerdere malen opschenken en is geschikt voor de Gong Fu Cha zetmethode."
Jangwon Oolong,1,https://www.simonlevelt.nl/jangwon-oolong,https://www.simonlevelt.nl/media/image/79/f9/5a/72eb3e93-e9ab-46f9-b351-5435eba753c0_600x600.png,"Geurige thee met een volzoete smaak en een sterk notig aroma met tonen van stro en tabak. Prachtige, biologische thee van het Zuidkoreaanse eiland Jeju gelegen tussen de thee grootmachten China & Japan."
Matcha Kirishima Okumidori - 30 gram,1,https://www.simonlevelt.nl/matcha-kirishima-okumidori-30-gram,https://www.simonlevelt.nl/media/image/27/d1/39/400e1962-337f-4d59-bed8-e02c65323df7_600x600.png,"Je proeft de kwaliteit in deze matcha, dat ook wel bekend staat als de beste organic matcha van Japan. Geniet van de lange zoete afdronk en de combinatie van umami en zoet in de smaak.   Deze “single origin, single cultivar” thee is van de variëteit Okumidori. De theeplantage ligt in Kirishima, grenzend aan een baai van de Stille Oceaan waarin de actieve Sakurajima vulkaan ligt. De vulkanische, mineraalrijke grond geeft de thee zijn aroma en diepe smaak.  De matcha is met een granieten molen gemalen waarbij de smaak en kleur van de matcha  optimaal bewaard blijft. Deze molen maalt slechts 30g per uur."
Darjeeling Finest Premium Organic Tea - 90 gram...,1,https://www.simonlevelt.nl/darjeeling-finest-premium-organic-tea-90-gram-losse-thee,https://www.simonlevelt.nl/media/image/9e/85/66/3d4876a1-9e48-48ed-ad6c-4c6f2244733a_600x600.png,"Alleen thee die echt uit Darjeeling komt, mag Darjeeling thee heten. En de karakteristieke Darjeeling smaak van muskaatdruif is in de Premium Organic Darjeeling Finest zeker aanwezig. Ben je op zoek naar een subtiele en pure thee van topkwaliteit, dan moet je deze zeker eens proberen. Je zult er geen spijt van krijgen!"
Lemongrass Green Premium Organic Tea - 90g...,1,https://www.simonlevelt.nl/lemongrass-green-premium-organic-tea-90g-losse-thee,https://www.simonlevelt.nl/media/image/c0/4f/96/943649ef-0c24-4f7f-9705-14c77db6a6a3_600x600.png,"Citroengras wordt ook wel sereh genoemd en is een van dé smaakmakers in de Aziatische keuken. In onze Premium Organic Lemongrass Green hebben we dit kruid gecombineerd met een subtiele groene thee. De smaakcombinatie die zo is ontstaan, is delicaat en fris. Verkwikkend zonder je smaakpapillen te overweldigen en daardoor lekker om de hele dag door te drinken!"
Bukit Sari Imperial Black,1,https://www.simonlevelt.nl/bukit-sari-imperial-black,https://www.simonlevelt.nl/media/image/b8/45/45/3723756d-f0c2-4ad4-b995-b6e42ef1f00c_600x600.png,"De Bukit Sari Imperial Black is een prachtige, fluwelige zwarte thee waarin je een rijk scala aan aroma’s kunt herkennen. Geen thee voor als je haast hebt dus! Integendeel, schenk hem gerust meerdere keren op volgens de Gong Fu Cha methode, en proef hem met je volle aandacht. Bij elke opschenking zal je weer iets nieuws ontdekken. Het friszoete van vijgen, rozijnen en zoethout gecombineerd met een hint van asperge en boterbonen en tot slot het bloemige van rozenblad. Wat proef jij in deze thee? Laat het ons weten in een review!"
Keijzer Parel,1,https://www.simonlevelt.nl/keijzer-parel,https://www.simonlevelt.nl/media/image/14/f2/9d/3aa28e9b-ee40-4bac-890c-fc76194fe9cd_600x600.png,"Parel van thee die zich ontvouwt als een zeeanemoon. Silvertip (witpunt-thee) met de hand gerold tot een grote, heel bijzonder gevormde theekogel, die zich als een zeeanemoon ontplooit tijdens het zetten. Deze delicate groene thee heeft een zoet en fruitig karakter van lychee en ramboetan. 5 parels in cadeauverpakking."
Turmeric Carrot - 20 builen,1,https://www.simonlevelt.nl/turmeric-carrot-20-builen,https://www.simonlevelt.nl/media/image/f9/39/b3/594d8393-dfab-42f1-9bb3-116127d5d60d_600x600.png,Turmeric Carrot Premium Organic Tea is een rijke kruidenmelange. Zoete aardse smaken van wortel gecombineerd met het kruidige van kurkuma op een basis van brandnetel. Een doosje bevat 20 theezakjes Premium Organic Turmeric Carrot.
Ambootia Regenpluk,1,https://www.simonlevelt.nl/ambootia-regenpluk,https://www.simonlevelt.nl/media/image/bf/e4/e7/d10a7caf-9c14-40ea-bf0f-0bc9e7968112N1tmpPVu1aiHu_600x600.png,"Geurige regenpluk met een ronde en soepele smaak. Deze Monsoon Flush maakt nogmaals duidelijk tot welke topprestatie de Ambootia tuin in staat is. Deze geurige regenpluk heeft een ronde, soepele smaak met een mild karakter en kleurt bruinrood in de kop."
Maté,1,https://www.simonlevelt.nl/mate,https://www.simonlevelt.nl/media/image/d7/8b/c7/b5991c73-85dc-4c19-a8f5-15d589084ad0_600x600.png,Volksdrank uit Argentinie;. Verkwikkend met zacht-bittere smaak. Mate is een groene boom die in de subtropische regenwouden van Zuid-Amerika groeit. Zowel de bladeren als de schors worden door de indianen daar al eeuwenlang gebruikt voor het maken van deze verkwikkende kruidenthee met cafeïne.
Selectie 3 Theeparels in cadeauverpakking,1,https://www.simonlevelt.nl/selectie-3-theeparels-in-cadeauverpakking,https://www.simonlevelt.nl/media/image/d7/c0/5d/0098fab0-2cf6-4d39-bc8d-a89ae68bfab6_600x600.png,"Theeparels maken je theemoment helemaal bijzonder. Deze parels ontvouwen zich in warm water als een zeeanemoon, wat zeker een show te noemen is! Deze selectie bevat drie verschillende parels. De Keijzer parel is een delicate groene thee met silvertips. De thee heeft een zoet en fruitig karakter van lychee en ramboetan. Ook de rose theeparel is een mooie groene thee. Zoals de naam al doet vermoeden ontdek je in deze thee een lichte hint van roos. Uit de theeparel komt een mooi rozenbloemknopje te voorschijn. De Marigold theeparel is een groene theeparel met een milde smaak en licht bloemige geur. Wanneer de theeparel zich ontvouwt verschijnt er een goudsbloem."
Matcha Uji Midori 30 gram,1,https://www.simonlevelt.nl/matcha-uji-midori-30-gram,https://www.simonlevelt.nl/media/image/dc/38/2a/e163ccfe-14df-42cd-84dd-bff424ec8b00_600x600.png,"Als je deze premium kwaliteit Matcha drinkt, bevind je je in voornaam gezelschap. De producent van Matcha Uji Midori is namelijk leverancier van het Japanse keizerlijk hof. Dat geeft je traditionele theeceremonie toch net dat beetje extra klasse! De volle en umima-rijke smaak heeft een goede balans tussen zoet en bitter. Geniet van de frisse en licht grassige aroma van Matcha Uji Midori."
Sencha Theïne-arm,1,https://www.simonlevelt.nl/sencha-theine-arm,https://www.simonlevelt.nl/media/image/3b/17/f6/436ab65a-a8f8-414a-b0fc-e9c568f813f1_600x600.png,Groene thee met een soepele en frisse smaak. Voor het decafeineren van de thee gebruiken we de CO2-methode. Bij het gebruik van deze methode is er weinig smaakverlies en blijft er geen CO2 achter. De smaak is iets ronder dan de reguliere Sencha en de thee heeft ook iets meer kleur. Deze groene Sencha thee wordt op Japanse manier geproduceerd in China. Door herhaaldelijk rollen en pletten ontstaat de typische vorm van platte naalden.
Tonganagaon 2nd flush,1,https://www.simonlevelt.nl/tonganagaon-2nd-flush,https://www.simonlevelt.nl/media/image/b8/c0/d7/2ba8e9c0-59ef-4f71-813a-ba611215ae46_600x600.png,"Drink jij het liefst thee die niet of nauwelijks bitter bevat? Dan is deze volle en fluwelige thee van de gelijknamige Tonganagaon Tea Garden in Assam wat voor jou. De lange naam heeft een mooi verhaal. Het is namelijk vernoemd naar de legende van de God Parashurama, die vaak staat afgebeeld met een bijl in zijn handen tijdens een bezoek aan een dorp in het oosten van Assam. Tongana betekent dan ook letterijk ‘bijl’ en ‘gaon’ betekent dorp.  Van deze in 1927 opgerichte plantage hebben wij een schitterende high end Assam thee geselecteerd. Deze zwarte thee heeft een volle, krachtige smaak met een mooie balans tussen de kracht, moutig en zoetig. Ontdek hints van krenten en mout, de aangename fluwelen body en de iets droge afdronk. Ook geschikt om te drinken als “Oostfriese thee” met melk/room en suiker."
Van Harte,1,https://www.simonlevelt.nl/van-harte,https://www.simonlevelt.nl/media/image/dc/28/0b/27cc832a-6a05-49a7-9f5b-e9898c4fe9e2_600x600.png,"Bouw een feestje in je theekop met deze zwarte thee versierd met kokosschilfers, goudsbloemen en sinaasappelschillen. Het perfecte cadeau voor de jarige of om je eigen verjaardag extra feestelijk mee te starten."
Orange Pekoe Looizuurarm,1,https://www.simonlevelt.nl/orange-pekoe-looizuurarm,https://www.simonlevelt.nl/media/image/dd/07/20/b4996d59-b141-444f-ae6d-fa2b0219dc7c_600x600.png,"Melange van China-thee, geselecteerd op een laag looizuurgehalte. Zacht en soepel."
Matcha Garucha - 30 gram,1,https://www.simonlevelt.nl/matcha-garucha-30-gram,https://www.simonlevelt.nl/media/image/04/74/90/2e3a08aa-aeec-4c4f-a13d-6474f2283c36_600x600.png,"Deze krachtige Matcha poederthee is uitermate geschikt voor culinair gebruik. Het is ook mogelijk deze Matcha op de traditionele wijze te bereiden. De theeblaadjes worden gestoomd, gedroogd en daarna in een stenen vijzel verpulverd zodat er een groen poeder overblijft."
Jasili Theebloemen,1,https://www.simonlevelt.nl/jasili-theebloemen,https://www.simonlevelt.nl/media/image/a6/a7/c7/1d31282c-1e2c-4885-8811-c6706f8ccc80_600x600.png,"Jasili theebloemen gemaakt van groen thee uit Fujian, China. Deze met de hand gebonden theebloem ontpopt zich in de theepot, een waar spektakel aan tafel! In de geschenkverpakking vind je: - Jasili Wonderwell (jasmijnbloemen&goudsbloem) - Jasili Precious (daglelie) - Jasili Lavender Green (lavendel&jasmijn) - Jasili happy Rose (roos, goudsbloem&jasmijn) - Jasili Mystery (daglelie&jasmijnbloesem)"
Pink Grapefruit & Orange,1,https://www.simonlevelt.nl/pink-grapefruit-orange,https://www.simonlevelt.nl/media/image/98/3f/b4/ecc1ee8a-e5ef-4cf6-a659-4b74758aec6b_600x600.png,"Geniet van de verfrissende smaakt van deze fruitmelange met roze grapefruit en sinaasappel. Schenk je kopje thee in en geniet van de intense ervaring van citrusvruchten; verfrissend, opwekkend, sappig en met een klein bittertje. De thee is in balans door de toevoeging van appelstukjes, citroengras, rozemarijn en hibiscus. Dit zorgt ervoor dat je naast de frisse tonen ook lichtzoete en lichtkruidige tonen proeft. Een fantastische dorstlesser!"
Seeyok Spring 1st flush,1,https://www.simonlevelt.nl/seeyok-spring-1st-flush,https://www.simonlevelt.nl/media/image/74/79/de/Seeyok_Spring_1_600x600.png,"De Seeyok Spring is een prachtige 1st flush die bloemig en aromatisch is. Ontdek de milde boterige tonen, de grassmaken en de karakteristieke smaak van muscateldruiven. Deze veelzijdige thee leent zich perfect om te experimenteren met de watertemperatuur: gebruik water met een hogere temperatuur voor meer astringentie en water met een lagere temperatuur voor meer zoetheid. Een thee om van te genieten, keer op keer, hoe je hem ook zet. Zodra de theestruik in de vroege lente begint te groeien, wordt er al snel geplukt. Voor deze 1st flush wordt enkel het jongste blad geplukt. Hoewel de thee qua bewerking een zwarte thee is, vind je dit niet terug in de smaak en het uiterlijk; de thee is licht van kleur, groenig en heeft veel grassige en bloemige tonen. Het jonge blad is erg aromatisch, verfijnd en intens van geur.  De Seeyok Tea Garden ligt in de Mirik Valley op de grens van India en Nepal. Seeyok staat garant voor het leveren van een hoge kwaliteit thee, waarvoor ze in 2019 de prestigeuze ""Excellence at Origin - Award"" hebben gewonnen voor de beste ""First Flush Darjeeling"". De plantage is gelegen in de Mirik Valley op een hoogte van 1100 tot 1800 meter. De combinatie van de hoge ligging, de regenval, de rijke grond en de aangeplante schadumbomen, dragen bij aan de kwaliteit van de thee die in het gebied groeit. In de vallei en op de plantage staan veel verschillende bomen waardoor het een goede habitat is voor een grote diversiteit aan dieren zoals beren, herten, papegaaien en uilen."
Vlierbes & Braam,1,https://www.simonlevelt.nl/vlierbes-braam,https://www.simonlevelt.nl/media/image/97/04/c1/Vlierbes_600x600.png,"Vlierbes & Braam is een fruitthee met de friszoete, volle en rijke smaak van rode vruchten. Ontdek vlierbessen, bramen, rozijnen en frambozen. De flinke dosis hibiscus geeft de thee een frisse hint. De thee heeft een volle body en is haast “siroperig” te noemen. De thee is opvallend versierd met frisgroen bucco blad. Dit blad groeid in Zuid-Afrika en heeft een geur die doet denken aan zwarte bes. Dat matcht perfect met de rode vruchten uit deze thee. Een sprankelende fruitthee met een intens rode kleur in de kop. Ook zeer geschikt als ijsthee!"
Rooibos Green Raspberry Orange,1,https://www.simonlevelt.nl/rooibos-green-raspberry-orange,https://www.simonlevelt.nl/media/image/4a/58/68/ec555350-1b80-4f9e-8524-e831d7d8de73_600x600.png,Rooibos Green Raspberry Orange is een bijzondere groene rooibos thee versierd met fruitige frambozen- en friszoete sinaasappelstukjes. Het vleugje rozenbottel en braamblad zorgen ervoor dat de thee fris en energiek smaakt. Dit maakt het een perfecte thee voor een positieve boost en een opgewekt gevoel.  Groene rooibos is afkomstig van dezelfde struik als normale rode rooibos. De groene variant wordt echter niet gefermenteerd en is daardoor mild en licht van smaak. Hierdoor is groene rooibos dé perfecte basis voor een energieke en opgewekte rooibos thee!
Langkloof Honeybush,1,https://www.simonlevelt.nl/langkloof-honeybush,https://www.simonlevelt.nl/media/image/0b/b9/01/Langkloof_Honeybush_1_600x600.png,"Deze Honeybush heeft een lichtzoete en kruidige smaak en is afkomstig uit de Langkloof Valley, Eastern Cape. De thee is honingachtig, vol en verwarmend. Geniet op elk moment van de dag van deze cafeïnevrije (theïnevrije) thee, perfect gebalanceerd en verwarmend door de milde smaak. De struik waar de thee van gemaakt wordt groeit in de Cape Floristic Region, een gebied in het zuidwesten van Zuid-Afrika. De unieke beplanting die in het gebied voorkomt wordt “fynbos” genoemd, verwijzend naar de fijne naaldjes aan de struiken. Na het plukken van de naaldjes, vindt de oxidatie plaats in stoomtanks. De Honeybush Company heeft na jarenlang experimenteren hét optimale proces ontwikkeld voor het oogsten en verwerken van Honeybush, met als doel de beste kwaliteit en smaak te kunnen leveren. Deze kwaliteitsstandaard is tot stand gekomen in samenwerking met de Universiteit van Stellenbosch. Dit resulteert in een heerlijke Honeybush met een zachtzoete aroma van fynbos en tasting notes van abrikoos, zoete appel en een vleugje roos."
Ginger & Cinnamon,1,https://www.simonlevelt.nl/ginger-cinnamon,https://www.simonlevelt.nl/media/image/d9/54/73/868ea668-7cc7-4ea6-81d9-49422dfb2834_600x600.png,"Ginger & Cinnamon is de perfecte thee voor de wintermaanden. Het is een heerlijke combinatie van groene thee en trendy kruiden. Chinese Gunpowder thee is de basis van deze thee. Gunpowder dankt haar naam aan de grijsgroene balletjes van opgerolde bladeren die op buskruit lijken. Het is een stevige en kruidige groene thee. Toegevoegd is een flinke dosis gember en overheerlijke stukjes kaneel. De thee is verrijkt met de smaak van honing en dat maakt de thee heerlijk vol, rond en rijk."
Relax Melange,1,https://www.simonlevelt.nl/relax-melange,https://www.simonlevelt.nl/media/image/af/15/34/Relax-Melange_1_600x600.png,"Een overheerlijke, ontspannende kruidenthee, dat is de Relax Melange. Kom even helemaal tot rust met deze kruidenthee zonder cafeïne en theïne, maar met een verrassende mix van de lekkerste kruiden. De thee zoet door de venkel, anijs en braamblad, fris door de citroengras en rozemarijn en warmkruidig door de gember, kurkuma en kaneelstukjes. De intense smaak is te omschrijven als friszoet, dropachtig en licht spicy in de nasmaak. De diverse kruiden en de daarbij behorende smaken, komen heel mooi samen en zorgen voor een volle en rijke smaakervaring. Kortom, ga zitten en relax!"
Sencha Classic,1,https://www.simonlevelt.nl/sencha-classic,https://www.simonlevelt.nl/media/image/57/e7/b5/Sencha-Classisc_600x600.png,"Sencha is de populairste thee van Japan en staat bekend om zijn subtiele zoete tonen, milde en verfrissende astringentie en elegante geur. Deze biologische Japanse sencha heeft mooi donkergroen en lichtglanzend blad met de kenmerkende naaldvorm. Het aroma is intens en de thee heeft een volromige body en aangenaam lange nasmaak. Ontdek tonen van alfalfa, boterbonen, sperziebonen en artsjok. Bij 3 minuten is de thee prachtig in balans, bij 5 minuten wordt het grassiger met meer trek. Experimenteer vooral met de zettijd en de hoeveelheid thee om de verschillende smaken te ontdekken."
Sweet Chai,1,https://www.simonlevelt.nl/sweet-chai,https://www.simonlevelt.nl/media/image/bf/e8/b5/e8e77f56-4b66-41bb-95f2-ff49027101e9_600x600.png,"Sweet Chai is echt een heerlijke thee! Het is een zwarte thee uit het Zuiden van India, gemixt met Chai en cacaoschillen. Chai is een mengsel van kaneel, gember, kruidnagel, kardemom en zwarte peper. Dát maakt de thee heerlijk warm en kruidig. De flinke dosis cacaoschillen zorgt voor een ervaring van volle, echte chocolade. Dit samen met de smaak van amandelen zorgt voor een intense belevenis. De Sweet Chai moet je echt proeven!"
White Moonlight bio,1,https://www.simonlevelt.nl/white-moonlight-bio,https://www.simonlevelt.nl/media/image/c6/96/a7/4cc60e03-3f77-4cf9-8b6e-3e8f63ada090_600x600.png,"White Moonlight is een prachtige en delicate thee. Het is een zomerpluk met een prachtig blad van de Chinese variëteit Yunnan Large Leaf Tree. Deze thee kenmerkt zich door het grote, witgrijze blad, waarbij de bladknop bedekt is met witte donshaartjes. Dit geeft de thee een bloemige en iets notige smaak. De thee is licht en delicaat met zachte, zoete tonen van onder meer lindebloesem en boterbonen. Liefhebbers zetten de thee meerdere malen en ontdekken zo het prachtige smaakpallet van deze White Moonlight. De Chinese naam van de White Moonlight is “Yue Guang Bai”. Ook is deze thee bekend onder de klinkende naam Moonlight Beauty. Deze naam heeft de thee te danken aan een legende. Volgens de legende wordt de thee enkel in de nacht bij maanlicht geplukt door knappe jonge vrouwen (Moonlight Beauty). Dit zou worden gedaan om te voorkomen dat het juist geplukte theeblad direct aan het felle zonlicht zou worden vrijgesteld. Een ander verhaal is dat de naam White Moonlight is gekozen vanwege de kleur en vorm van het theeblad: de grote wit kleurige bladknop met zilveren donshaartjes bovenop het donkere theeblad doet denken aan de maan in een donkere nacht."
Rooibos Sweet Sensation,1,https://www.simonlevelt.nl/rooibos-sweet-sensation,https://www.simonlevelt.nl/media/image/d9/57/e0/0b391dd9-39c8-4443-a13e-2ed13a63f322_600x600.png,Rooibos Sweet Sensation is een aangename en volle thee met een intense en zoete totaalervaring. De pure rooibos thee is verrijkt met de smaak van amandel en honing. Stukjes kokos geven de thee extra body.
Raspberry & Rose,1,https://www.simonlevelt.nl/raspberry-rose,https://www.simonlevelt.nl/media/image/dd/06/1e/Raspberry-Rose_2_600x600.png,Raspberry & Rose is een heerlijke uitgebalanceerde zwarte thee melange van thee uit India en Afrika. De thee is verrijkt met de zoete frambozenstukjes en goudsbloemen en de bloemige smaak van rozen.
Bancha Hojicha,1,https://www.simonlevelt.nl/bancha-hojicha,https://www.simonlevelt.nl/media/image/d9/85/3c/Bancha_-Afbeelding-1t1fxy1VKTwZ1I_600x600.png,"Bancha Hojicha is een geroosterde groene thee uit Japan. De thee is mild en zachtzoet met een hint van noten, hout en caramel, ontstaan door het roosteren van de thee.  De basis van deze Bancha Hojicha is Bancha. Bancha betekent ‘gewone’ thee en wordt gemaakt van een wat ouder en groter blad. Dit blad wordt mechanisch geplukt om de theestruiken tussen de oogsten door een stukje in te korten en op gelijk niveau te brengen. Automatisch wordt daarmee wat ouder en dikker blad geplukt. Na het plukken wordt de thee verder verwerkt. De letterlijke betekenis van Hojicha is “geroosterde thee”. Hojicha volgt grotendeels het productieproces van de typische Japanse groene thee. Het grote verschil is dat Hojicha na de verwerking op een hele hoge temperatuur van meer dan 300 graden wordt geroosterd. Dit geeft het theeblad zijn bruine kleur én karakteristieke smaak. Ook zorgt dit proces ervoor dat de thee minder cafeïne bevat dan normale thee."
Rozemarijn & Citroengras,1,https://www.simonlevelt.nl/rozemarijn-citroengras,https://www.simonlevelt.nl/media/image/63/62/a1/cee55c8a-5384-4b7d-9f18-8c84852c5f95_600x600.png,"De basis van de Rozemarijn & Citroengras thee is een Chinese groene thee, Chunmee Young Hyson. De thee is gekozen, omdat deze een kruidige en grassige smaak heeft die perfect combineert met de kruiden die in deze mix zijn opgenomen. Een heerlijke groene thee met kruiden voor elk moment van de dag."
Shibushi Sencha,1,https://www.simonlevelt.nl/shibushi-sencha,https://www.simonlevelt.nl/media/image/09/4b/31/Shibushi-Sencha_2_600x600.png,"Shibushi Sencha is een bijzondere Japanse Sencha uit de Shibushi regio. Deze thee heeft een prachtig uitziend theeblad met een volle en stevige smaak. Proef tonen van onder andere gras, taugé en peterselie. Een lichtkruidige en volzoete thee die zeker in de smaak valt! Voor de Shibushi Sencha wordt gebruik gemaakt van de theevariëteit Sayamakaori. Dit is een vroege zomerpluk (mei/juni) die speciaal is ontwikkeld voor Sencha thee. Sayamakaori staat bekend om zijn mooie, bloemige geur en krachtige, ietwat astringente aroma. Karakteristieken die passen bij een goede Sencha thee en bij deze mooie Shibushi Sencha!"
Strawberry & Rose,1,https://www.simonlevelt.nl/strawberry-rose,https://www.simonlevelt.nl/media/image/dc/58/f6/aa12fb78-ab2a-4b26-8d4a-97269b95fa13_600x600.png,"Sencha thee uit China is de mildfrisse basis van deze groene thee Strawberry & Rose. De thee is versierd met zoete stukjes aardbei én geurige rozenblaadjes. Het resultaat is een vrolijk uitziende, heerlijke zachte thee met de zoete zweem van aardbei en roos. Een aangename thee voor elk moment van de dag, het hele jaar door!"
Orange & Cinnamon,1,https://www.simonlevelt.nl/orange-cinnamon,https://www.simonlevelt.nl/media/image/52/a8/9a/d9a44d3d-ebd1-463b-a787-e1ebe1f8746e_600x600.png,"De basis van Orange & Cinnamon is de delicate Chinese witte thee, Pai Mu Tan. Het heeft een prachtig, groot theeblad met veel tip. Dit maakt de thee van zichzelf zacht, geurig en aangenaam zoetig. Deze mooie thee is verrijkt met fruitige sinaasappelschillen en verwarmende stukjes kaneel en cacao. De rijk geurende cacaoschillen in deze thee zijn oorspronkelijk een restproduct van chocoladeproducent Original Beans, maar maken deze thee helemaal compleet. Ter versiering zijn prachtige geel/oranje gekleurde goudsbloemen toegevoegd. Orange & Cinnamon is een herfstachtige combinatie van smaken waar je het hele jaar door van zult genieten!"
